Name,Description,Latitude,Longitude,InfoURL,ImageURL
UCSB,A great university located along California coast,34.416929,-119.845991,"https://en.wikipedia.org/wiki/University_of_California,_Santa_Barbara",https://web.physics.ucsb.edu/~Women/images/ucsb-big.jpg
Eiffel Tower,"An iconic landmark of France, located in Paris. A marvel of iron architecture.",48.858093,2.294694,https://en.wikipedia.org/wiki/Eiffel_Tower,https://upload.wikimedia.org/wikipedia/commons/a/a8/Tour_Eiffel_Wikimedia_Commons.jpg
Taj Mahal,"A magnificent white marble mausoleum in Agra, India, built in the 17th century.",27.173891,78.042068,https://en.wikipedia.org/wiki/Taj_Mahal,https://upload.wikimedia.org/wikipedia/commons/1/1d/Taj_Mahal_%28Edited%29.jpeg
Great Wall of China,"A series of fortifications made of stone, brick, and other materials, stretching from east to west across northern China.",40.431908,116.570374,https://en.wikipedia.org/wiki/Great_Wall_of_China,https://upload.wikimedia.org/wikipedia/commons/2/23/The_Great_Wall_of_China_at_Jinshanling-edit.jpg
Machu Picchu,"An ancient Incan citadel set high in the Andes Mountains of Peru, renowned for its archaeological significance.",-13.163068,-72.545128,https://en.wikipedia.org/wiki/Machu_Picchu,https://upload.wikimedia.org/wikipedia/commons/0/01/80_-_Machu_Picchu_-_Juin_2009_-_edit.2.jpg
Grand Canyon,"A steep-sided canyon carved by the Colorado River in the state of Arizona, USA. It showcases millions of years of geological history.",36.056595,-112.125092,https://en.wikipedia.org/wiki/Grand_Canyon,https://upload.wikimedia.org/wikipedia/commons/a/aa/Dawn_on_the_S_rim_of_the_Grand_Canyon_%288645178272%29.jpg
